{"head":{"layout":"Post","title":"My Second Post!","date":"2015-05-06T23:46:37.121Z","route":"my-second-post","category":"FrontEnd","description":"Civil society; save lives pathway to a better life public-private partnerships solution, tackle, protect UNHCR social movement Jane Addams sustainable campaign respond equality."},"body":"<p>Wow! I love blogging so much already.</p>\n<p>Did you know that &quot;despite its name, salted duck eggs can also be made from chicken eggs, though the taste and texture will be somewhat different, and the egg yolk will be less rich.&quot;? (<a href=\"http://en.wikipedia.org/wiki/Salted_duck_egg\">Wikipedia Link</a>)</p>\n<p>Yeah, I didn&#x27;t either.</p>\n","rawBody":"\nWow! I love blogging so much already.\n\nDid you know that \"despite its name, salted duck eggs can also be made from chicken eggs, though the taste and texture will be somewhat different, and the egg yolk will be less rich.\"? ([Wikipedia Link](http://en.wikipedia.org/wiki/Salted_duck_egg))\n\nYeah, I didn't either.\n","raw":"---\nlayout: Post\ntitle: My Second Post!\ndate: \"2015-05-06T23:46:37.121Z\"\nroute: \"my-second-post\"\ncategory: \"FrontEnd\"\ndescription: \"Civil society; save lives pathway to a better life public-private partnerships solution, tackle, protect UNHCR social movement Jane Addams sustainable campaign respond equality.\"\n---\n\nWow! I love blogging so much already.\n\nDid you know that \"despite its name, salted duck eggs can also be made from chicken eggs, though the taste and texture will be somewhat different, and the egg yolk will be less rich.\"? ([Wikipedia Link](http://en.wikipedia.org/wiki/Salted_duck_egg))\n\nYeah, I didn't either.\n","__filename":"my-second-post/index.md","__url":"/my-second-post/","__resourceUrl":"/my-second-post/index.html","__dataUrl":"/my-second-post/index.html.6d49bdfa71b2015e6aa2c2fec6d6f8d4.json"}